SKU,title,reason,has_price_row,has_buy,has_listino,has_stock_row,qty,passes_qty,has_image
132076,"Desk set evidenziatori Q-Connect Pastel 1,5-5 mm - colori pastello assortiti conf. 23 pezzi - KF17782",SCARTO_STOCK_SOTTO_SOGLIA,True,True,True,True,0.0,False,True
132201,"Marcatore a tempera Uni Posca Poscapen ultra-fine 0,7 mm conf. 9 pz rosso M 84020266",SCARTO_STOCK_SOTTO_SOGLIA,True,True,True,True,0.0,False,True
132272,Memoria SSD esterna portatile Verbatim Store'n'Go USB 3.2 nera 500 GB 53250,SCARTO_STOCK_SOTTO_SOGLIA,True,True,True,True,0.0,False,True
132273,Memoria SSD esterna portatile Verbatim Store'n'Go USB 3.2 nera 1 TB 53230,SCARTO_STOCK_SOTTO_SOGLIA,True,True,True,True,3.0,False,True
132531,Alimentatore 2 porte USB-C 65W Trust Maxo - colore bianco - 25381,SCARTO_STOCK_SOTTO_SOGLIA,True,True,True,True,1.0,False,True
132532,Alimentatore 2 porte USB-C 65W Trust Maxo - colore nero - 25380,SCARTO_STOCK_SOTTO_SOGLIA,True,True,True,True,1.0,False,True
132533,Auricolari ENC bluethooth Trust Yavi bianco 25173,SCARTO_STOCK_SOTTO_SOGLIA,True,True,True,True,0.0,False,True
132534,Auricolari ENC bluethooth Trust Yavi nero 25298,SCARTO_STOCK_SOTTO_SOGLIA,True,True,True,True,0.0,False,True
132536,Auricolari ENC bluethooth Trust Yavi bianco-con gommino 25172,SCARTO_STOCK_SOTTO_SOGLIA,True,True,True,True,0.0,False,True
132538,Auricolari ENC bluethooth Trust Yavi porpora-con gommino 25297,SCARTO_STOCK_SOTTO_SOGLIA,True,True,True,True,1.0,False,True
132539,Borsa per laptop fino a 16'' Trust Lisboa nero 25246,SCARTO_STOCK_SOTTO_SOGLIA,True,True,True,True,0.0,False,True
132540,Caricabatterie Trust MAXO USB-C nero 100W 24818,SCARTO_STOCK_SOTTO_SOGLIA,True,True,True,True,2.0,False,True
132549,Mouse ultrasottile wireless ricaricabile Trust Puck - ricevitore USB A 2.0 azzurro - 24126,SCARTO_STOCK_SOTTO_SOGLIA,True,True,True,True,2.0,False,True
132551,Mouse wireless multi-dispositivo Trust Ozaa - bianco - 24935,SCARTO_STOCK_SOTTO_SOGLIA,True,True,True,True,1.0,False,True
132556,Powerbank ad alta capacità da 20.000 mAh Trust Primo nero 24676,SCARTO_STOCK_SOTTO_SOGLIA,True,True,True,True,1.0,False,True
132558,Powerbank ultrasottile da 5.000 mAh Trust Primo nero 24679,SCARTO_STOCK_SOTTO_SOGLIA,True,True,True,True,3.0,False,True
132560,Powerbank ultrasottile da 10.000 mAh Trust Primo - nero - 24678,SCARTO_STOCK_SOTTO_SOGLIA,True,True,True,True,3.0,False,True
132561,Powerbank ultrasottile da 10.000 mAh Trust Primo - verde - 25029,SCARTO_STOCK_SOTTO_SOGLIA,True,True,True,True,3.0,False,True
132572,Zaino per laptop Trust Lisboa capacità fino a 16'' eco-friendly - nero - 25244,SCARTO_STOCK_SOTTO_SOGLIA,True,True,True,True,2.0,False,True
132573,Zaino per laptop Trust Lisboa capacità fino a 16'' eco-friendly - verde - 25243,SCARTO_STOCK_SOTTO_SOGLIA,True,True,True,True,3.0,False,True
132638,Blocchi spiralati Blasetti Colorclub formato A5  carta 70 g conf. 6 pezzi assortiti rigatura 4 mm - 6520,SCARTO_STOCK_SOTTO_SOGLIA,True,True,True,True,0.0,False,True
132658,Mobiletto multifunzione Durable 74/59 aperto bianco 528x748x592 mm - 3113-02,SCARTO_STOCK_SOTTO_SOGLIA,True,True,True,True,2.0,False,True
132659,Stazione porta capsule Durable Coffee Point Box S 280x95x356 mm antracite - 3383-58,SCARTO_STOCK_SOTTO_SOGLIA,True,True,True,True,1.0,False,True
132660,Mobiletto multifunzione versatile Durable System 48 - 600x477x432 mm argento/faggio - 3710-124,SCARTO_STOCK_SOTTO_SOGLIA,True,True,True,True,1.0,False,True
132661,Mobiletto multifunzione versatile Durable System 88 - 750x879x432 mm grigio - 3711-10,SCARTO_STOCK_SOTTO_SOGLIA,True,True,True,True,2.0,False,True
132662,Cornice espositiva Durable Duraframe® A4 236x323 mm rosso - conf. 10 pz - 4882-03,SCARTO_STOCK_SOTTO_SOGLIA,True,True,True,True,4.0,False,True
132664,"Busta impermeabile A4 adesiva Durable 247x325x0,6 mm trasparente - conf. 5 pz - 5016-19",SCARTO_STOCK_SOTTO_SOGLIA,True,True,True,True,2.0,False,True
132667,Braccio porta 1 monitor da tavolo Durable Select grigio 429x448x100 mm 5094-23,SCARTO_STOCK_SOTTO_SOGLIA,True,True,True,True,2.0,False,True
132668,Braccio porta 1 monitor da tavolo Durable Select Plus con braccio estensibile 530x450x108 mm - 5096-23,SCARTO_STOCK_SOTTO_SOGLIA,True,True,True,True,1.0,False,True
132669,Braccio porta 2 monitor da tavolo Durable Select Plus con braccio estensibile 1086x450x145 mm - 5097-23,SCARTO_STOCK_SOTTO_SOGLIA,True,True,True,True,2.0,False,True
132670,Cassettiera Durable Varicolor® MIX 4 grigio 280x292x356 mm - 7624-27,SCARTO_STOCK_SOTTO_SOGLIA,True,True,True,True,2.0,False,True
132671,Cassettiera Durable Varicolor® MIX 4 SAFE con serratura - grigio 280x292x356 mm - 7626-27,SCARTO_STOCK_SOTTO_SOGLIA,True,True,True,True,1.0,False,True
132672,Cassettiera Durable Varicolor® MIX 7 280x292x356 mm - 7627-27,SCARTO_STOCK_SOTTO_SOGLIA,True,True,True,True,4.0,False,True
132674,Portanome Durable Click Fold 54x90 mm in PPL trasparente con magnete - 8215-19,SCARTO_STOCK_SOTTO_SOGLIA,True,True,True,True,1.0,False,True
132678,Supporto per tablet da tavolo Durable Tablet Holder Table XL 155x242x183 mm - 8937-23,SCARTO_STOCK_SOTTO_SOGLIA,True,True,True,True,1.0,False,True
132966,"Busta coprenti con soffietto Sei Rota Atla GS - 21x29,7 cm - privacy - colore bianco opaco - 662606",SCARTO_STOCK_SOTTO_SOGLIA,True,True,True,True,4.0,False,True
132970,Buste in PP buccia Sei Rota Atla 60 - basso spessore trasparente 22x30 cm - conf. 50 buste - 662208,SCARTO_STOCK_SOTTO_SOGLIA,True,True,True,True,0.0,False,True
132971,Buste in PP buccia Sei Rota Atla 100 - medio spessore trasparente 23x33 - conf. 25 buste - 662310,SCARTO_STOCK_SOTTO_SOGLIA,True,True,True,True,2.0,False,True
132981,Copertine per la rilegatura Sei Rota Video ROC formato A4 colore blu - conf. 100 pezzi - 52142807,SCARTO_STOCK_SOTTO_SOGLIA,True,True,True,True,2.0,False,True
132991,Portalistini UNO TI Sei Rota ad album PP buccia - A4 - 36 interni - blu - 55243607,SCARTO_STOCK_SOTTO_SOGLIA,True,True,True,True,0.0,False,True
133005,"Raccoglitore Sei Rota Nettuno - 4 anelli a R 30 mm - A4 - dorso 3,5 cm - colore rosso - 36803142",SCARTO_STOCK_SOTTO_SOGLIA,True,True,True,True,0.0,False,True
133012,"Raccoglitore Sei Rota Nettuno - 2 anelli a R 30 mm - A4 - dorso 3,5 cm - conf. 10 pz colori assortiti - 36773199",SCARTO_STOCK_SOTTO_SOGLIA,True,True,True,True,4.0,False,True
133282,Bicchiere per pennelli con coperchio Lebez - conf. 8 pezzi - 80124,SCARTO_STOCK_SOTTO_SOGLIA,True,True,True,True,4.0,False,True
133314,Portadepliant in acrilico con base a L - angoli magnetici Lebez A4 - verticale - trasparente - 7003,SCARTO_STOCK_SOTTO_SOGLIA,True,True,True,True,4.0,False,True
133332,Dorsini tondi in PVC Lebez - dorso 4 mm - colore blu - 871-BL,SCARTO_STOCK_SOTTO_SOGLIA,True,True,True,True,0.0,False,True
133338,Dorsini tondi in PVC Lebez - dorso 6 mm - colore rosso - 872-R,SCARTO_STOCK_SOTTO_SOGLIA,True,True,True,True,3.0,False,True
133340,Dorsini tondi in PVC Lebez - dorso 10 mm - colore blu - 874-BL,SCARTO_STOCK_SOTTO_SOGLIA,True,True,True,True,0.0,False,True
133342,Dorsini tondi in PVC Lebez - dorso 10 mm - colore rosso - 874-R,SCARTO_STOCK_SOTTO_SOGLIA,True,True,True,True,4.0,False,True
133346,Dorsini tondi in PVC Lebez - dorso 15 mm - colore rosso - 875-R,SCARTO_STOCK_SOTTO_SOGLIA,True,True,True,True,3.0,False,True
133354,Espositore 228 pennelli in pelo di pony Lebez - punte assortite da 1  a 12 - 1984L,SCARTO_STOCK_SOTTO_SOGLIA,True,True,True,True,1.0,False,True
133355,Espositore 324 pennelli Lebez punte e materiali assortiti - 81007,SCARTO_STOCK_SOTTO_SOGLIA,True,True,True,True,3.0,False,True
133358,Etichette con filo in cartoncino bianco Lebez formato 11x29 mm - conf. 1000 pezzi - A385,SCARTO_STOCK_SOTTO_SOGLIA,True,True,True,True,3.0,False,True
133359,Etichette con filo in cartoncino bianco Lebez formato 13x20 mm - conf. 1000 pezzi - A387,SCARTO_STOCK_SOTTO_SOGLIA,True,True,True,True,4.0,False,True
133361,Etichette con filo in cartoncino bianco Lebez formato 15x24 mm - conf. 1000 pezzi - A388,SCARTO_STOCK_SOTTO_SOGLIA,True,True,True,True,3.0,False,True
133370,Forbici Lebez Zig-Zag con 4 lame acciaio inox intercambiabili da 16 cm - colori assortiti tenui - 4333L,SCARTO_STOCK_SOTTO_SOGLIA,True,True,True,True,0.0,False,True
133381,Blister 10 lame segmentate Olfa 100x18 mm per cutter - LB10B,SCARTO_STOCK_SOTTO_SOGLIA,True,True,True,True,4.0,False,True
133412,Pennello punta tonda Lebez - pelo di bue - serie N.10 - conf. 12 pz 1557/10B,SCARTO_STOCK_SOTTO_SOGLIA,True,True,True,True,4.0,False,True
133414,Pennello punta tonda Lebez - pelo di bue - serie N.14 - conf. 12 pz 1557/14B,SCARTO_STOCK_SOTTO_SOGLIA,True,True,True,True,4.0,False,True
133428,Portablocco City Time Dual A4 in tessuto tecnico - 26x34 cm - nero - 61500,SCARTO_STOCK_SOTTO_SOGLIA,True,True,True,True,2.0,False,True
133445,Pressini fermafogli Lebez 38x150 mm - colori assortiti - conf. 250 pezzi - 361-ASS-B,SCARTO_STOCK_SOTTO_SOGLIA,True,True,True,True,4.0,False,True
133880,Espositore da banco 80 marcatori a tempera Uni Posca colori assortiti - punta PC1 - M PC1MR 80P,SCARTO_STOCK_SOTTO_SOGLIA,True,True,True,True,0.0,False,True
133881,Espositore da banco 60 marcatori a tempera - colori assortiti punta PC5 - M PC5M 5D,SCARTO_STOCK_SOTTO_SOGLIA,True,True,True,True,0.0,False,True
133887,Marcatore Uni Posca punta large colore oro M PC8K ORO,SCARTO_STOCK_SOTTO_SOGLIA,True,True,True,True,0.0,False,True
133996,Gessi tondi non polverosi Lebez Ø 9 mm colori assortiti - 20 conf. da 12 gessetti - 515,SCARTO_STOCK_SOTTO_SOGLIA,True,True,False,True,4.0,False,True
134003,Temperatatite lattina Lebez con serbatoio 2 fori - conf. 24 pz - 334,SCARTO_STOCK_SOTTO_SOGLIA,True,True,True,True,3.0,False,True
134021,Foglietti riposizionabili  Post-it® cubo in 3 colori brillanti assortiti formato fumetto - 2007 SP,SCARTO_STOCK_SOTTO_SOGLIA,True,True,True,True,4.0,False,True
134033,Astuccio in metallo 6 matite Faber-Castell 9000 - gradazioni assortite - 119063,SCARTO_STOCK_SOTTO_SOGLIA,True,True,True,True,3.0,False,True
134038,Confezione matite Faber-Castell Pitt Pastel - colore sanguigno - conf. 6 pezzi - 112288,SCARTO_STOCK_SOTTO_SOGLIA,True,True,True,True,3.0,False,True
134040,Pitt Artist Pen brush Faber-Castell colore avorio - conf. 10 pezzi - 167403,SCARTO_STOCK_SOTTO_SOGLIA,True,True,True,True,2.0,False,True
134042,Pitt Artist Pen brush Faber-Castell colore grigio caldo I - conf. 10 pezzi - 167570,SCARTO_STOCK_SOTTO_SOGLIA,True,True,True,True,3.0,False,True
134043,Pitt Artist Pen brush Faber-Castell colore grigio caldo III - conf. 10 pezzi - 167472,SCARTO_STOCK_SOTTO_SOGLIA,True,True,True,True,1.0,False,True
134044,Pitt Artist Pen brush Faber-Castell colore grigio caldo IV - conf. 10 pezzi - 167473,SCARTO_STOCK_SOTTO_SOGLIA,True,True,True,True,2.0,False,True
134045,Pitt Artist Pen brush Faber-Castell colore grigio caldo V - conf. 10 pezzi - 167474,SCARTO_STOCK_SOTTO_SOGLIA,True,True,True,True,4.0,False,True
134047,Pitt Artist Pen brush Faber-Castell colore grigio freddo III - conf. 10 pezzi - 167432,SCARTO_STOCK_SOTTO_SOGLIA,True,True,True,True,1.0,False,True
134048,Pitt Artist Pen brush Faber-Castell colore grigio freddo IV - conf. 10 pezzi - 167433,SCARTO_STOCK_SOTTO_SOGLIA,True,True,True,True,3.0,False,True
134051,Pitt Artist Pen brush Faber-Castell colore seppia scuro - conf. 10 pezzi - 167475,SCARTO_STOCK_SOTTO_SOGLIA,True,True,True,True,1.0,False,True
134052,Pitt Artist Pen Faber-Castell fineliner P super fine - colore nero - 167199,SCARTO_STOCK_SOTTO_SOGLIA,True,True,True,True,3.0,False,True
134137,Espositore da banco 470 evidenziatori Stabilo Boss - 30 colori assortiti - IT70/470-1,SCARTO_STOCK_SOTTO_SOGLIA,True,True,True,True,1.0,False,True
134139,Espositore 120 pennarelli Stabilo Pen 68 Max - 24 colori assortiti - IT768/120-1,SCARTO_STOCK_SOTTO_SOGLIA,True,True,True,True,0.0,False,True
134142,Pennarello Stabilo Pen 68 Max punta scalpello - conf. 12 pezzi - 768/12-21,SCARTO_STOCK_SOTTO_SOGLIA,True,True,True,True,2.0,False,True
134145,Pennarello Stabilo Pen 68 Max punta scalpello - conf. 20 pezzi - 768/20-31-20,SCARTO_STOCK_SOTTO_SOGLIA,True,True,True,True,1.0,False,True
134157,Espositore 15 evidenziatori Stabilo Boss - colore nero - 70/15-2-46,SCARTO_STOCK_SOTTO_SOGLIA,True,True,True,True,2.0,False,True
134211,Foglietti Post-it® Popmistic - conf. 6 blocchetti da 100 ff - 76x127 mm - 655-pop,SCARTO_STOCK_SOTTO_SOGLIA,True,True,True,True,0.0,False,True
134217,Espositore 312 pennelli Lebez Syntex in setola sintetica - punte assortite - 81330,SCARTO_STOCK_SOTTO_SOGLIA,True,True,True,True,0.0,False,True
134218,Pennelli Lebez Syntex in setole sintetiche - punta piatta - conf. 5 pz - 300B,SCARTO_STOCK_SOTTO_SOGLIA,True,True,True,True,2.0,False,True
134363,Pennarello Stabilo Point Max - punta nylon - colori assortiti - astuccio da 42 pezzi - 488/42-1-20,SCARTO_STOCK_SOTTO_SOGLIA,True,True,True,True,2.0,False,True
134364,Espositore da banco 60 pennarelli Stabilo Pen 68 metallic - colori assortiti - 68/60-8-1,SCARTO_STOCK_SOTTO_SOGLIA,True,True,True,True,2.0,False,True
134374,Espositore da terra 550 evidenziatori Stabilo Boss -  colori assortiti IT70/550-6,SCARTO_STOCK_SOTTO_SOGLIA,True,True,True,True,0.0,False,True
134376,Stabilo Colorful Arty Creative set pastel - conf. 50 pz - 77/6-2-20,SCARTO_STOCK_SOTTO_SOGLIA,True,True,True,True,3.0,False,True
134386,Stabilo rollerset Arty Edition Point 88 e Pen 68 - conf. 12 pz - colori assortiti - 25/26-06-1,SCARTO_STOCK_SOTTO_SOGLIA,True,True,True,True,0.0,False,True
134408,Espositore 96 penne a sfera Pilot Frixion Ball Naruto limited edition - colori assortiti - 009701,SCARTO_STOCK_SOTTO_SOGLIA,True,True,True,True,0.0,False,True
134415,Espositore 576 matite Staedtler Mars Lumograph - gradazioni assortite - 100 VS4,SCARTO_STOCK_SOTTO_SOGLIA,True,True,True,True,1.0,False,True
134418,Espositore da banco 32 articoli Staedtler Noris Jumbo - assortiti - 61 CA NJ,SCARTO_STOCK_SOTTO_SOGLIA,True,True,True,True,2.0,False,True
134551,Espositore 46 evidenziatori Faber-Castell Textliner - colori assortiti - 254653,SCARTO_STOCK_SOTTO_SOGLIA,True,True,True,True,0.0,False,True
134565,Matita Faber-Castell Jumbo Grip - conf. 10 pz - fantasia dinosauri 110922,SCARTO_STOCK_SOTTO_SOGLIA,True,True,True,True,3.0,False,True
134566,Penna a sfera a scatto Faber-Castell Daily Ball XB inchiostro blu - colore fusto lilla - conf. 10 pz - 140688,SCARTO_STOCK_SOTTO_SOGLIA,True,True,True,True,1.0,False,True
134567,Penna a sfera a scatto Faber-Castell Daily Ball XB inchiostro blu - colore fusto blu cielo - conf. 10 pz - 140689,SCARTO_STOCK_SOTTO_SOGLIA,True,True,True,True,2.0,False,True
134568,Penna a sfera a scatto Faber-Castell Daily Ball XB inchiostro blu - colore fusto nero - conf. 10 pz - 140690,SCARTO_STOCK_SOTTO_SOGLIA,True,True,True,True,2.0,False,True
134569,Espositore 40 penne a sfera a scatto Faber-Castell Daily Ball XB inchiostro blu - fusto colori assortiti - 140691,SCARTO_STOCK_SOTTO_SOGLIA,True,True,True,True,2.0,False,True
134572,Matita in grafite Faber-Castell Grip 2001 - conf. 12 pz - colore fusto blu cielo - 517074,SCARTO_STOCK_SOTTO_SOGLIA,True,True,True,True,3.0,False,True
134573,Matita Faber-Castell Jumbo Grip - conf. 12 pz - colore blu cielo 111974,SCARTO_STOCK_SOTTO_SOGLIA,True,True,True,True,4.0,False,True
134574,Portamine Faber-Castell Grip 2010 - conf. 5 pz - colore fusto blu cielo 231028,SCARTO_STOCK_SOTTO_SOGLIA,True,True,True,True,3.0,False,True
134579,Temperamatite Faber-Castell grip mini - conf. 10 pz - colore blu cielo 183774,SCARTO_STOCK_SOTTO_SOGLIA,True,True,True,True,3.0,False,True
134580,Temperamatite Faber-Castell trio grip - conf. 10 pz - colore blu cielo 183874,SCARTO_STOCK_SOTTO_SOGLIA,True,True,True,True,4.0,False,True
134713,Espositore 12 astucci a bustina Pigna monocromo in silicone assortiti 023264600,SCARTO_STOCK_SOTTO_SOGLIA,True,True,True,True,2.0,False,True
134772,Espositore 20 gomme eco Staedtler verde oliva 526 80-5,SCARTO_STOCK_SOTTO_SOGLIA,True,True,True,True,2.0,False,True
134773,Espositore 72 matite con gommino Staedtler Noris® HB 122 KP72,SCARTO_STOCK_SOTTO_SOGLIA,True,True,True,True,4.0,False,True
134816,Portalistini Sei Rota Asso in PP liscio 22x30 cm in colori assortiti 80 buste - 57218090,SCARTO_STOCK_SOTTO_SOGLIA,True,True,True,True,4.0,False,True
134817,Portalistini Sei Rota Asso in PP liscio 22x30 cm in colori assortiti 120 buste - 57241290,SCARTO_STOCK_SOTTO_SOGLIA,True,True,True,True,4.0,False,True
134818,Portalistini Sei Rota Asso in PP liscio 22x30 cm in colori assortiti 150 buste - 57241590,SCARTO_STOCK_SOTTO_SOGLIA,True,True,True,True,2.0,False,True
134830,Portanome in PVC rigido Sei Rota Pass 6 ST cordoncino+pinzetta+tasca in conf. da 10 pezzi - nero - 31841700,SCARTO_STOCK_SOTTO_SOGLIA,True,True,True,True,1.0,False,True
134865,Blocco registro IVA dei corrispettivi O.C.L. 24x2 copie - 0503,SCARTO_STOCK_SOTTO_SOGLIA,True,True,True,True,0.0,False,True
134868,"Blocco tascabile prima nota a 2 colonne O.C.L. 10,5x15 cm 20 fogli 0121N",SCARTO_STOCK_SOTTO_SOGLIA,True,True,True,True,0.0,False,True
134894,"Registro scadenzario O.C.L. 21x29,7 cm 24 fogli - 3003",SCARTO_STOCK_SOTTO_SOGLIA,True,True,True,True,0.0,False,True
134899,"Schede a tre colonne O.C.L. formato 21x14,8 cm - 0847",SCARTO_STOCK_SOTTO_SOGLIA,True,True,True,True,0.0,False,True
134902,"Schede rigate O.C.L. formato 21x14,8 cm - 0819",SCARTO_STOCK_SOTTO_SOGLIA,True,True,True,True,0.0,False,True
134956,Album da disegno Giotto Album Kids 200 g conf. 5 pz - A3 - 20 fogli F580500,SCARTO_STOCK_SOTTO_SOGLIA,True,True,True,True,1.0,False,True
134961,Espositore Kit 50 articoli Giotto di Natura Back To School 2024 - F960500,SCARTO_STOCK_SOTTO_SOGLIA,True,True,True,True,1.0,False,True
134964,Espositore 99 matite colorate Giotto Supermina varie + pennarelli New Turbocolor 209x44x50 cm - F947200,SCARTO_STOCK_SOTTO_SOGLIA,True,True,True,True,2.0,False,True
134965,Espositore 220 penne a sfera Tratto Cancellik - colori assortiti con inchiostro cancellabile - F817700,SCARTO_STOCK_SOTTO_SOGLIA,True,True,True,True,1.0,False,True
134970,Esporitore 558 matite colorate Giotto Supermina F235300,SCARTO_STOCK_SOTTO_SOGLIA,True,True,True,True,1.0,False,True
134971,Espositore Giotto 3 display Kit Party Set F313200,SCARTO_STOCK_SOTTO_SOGLIA,True,True,True,True,1.0,False,True
134982,Barattoli da banco Faber-Castell Jumbo greep two tone in grafite - conf. 72 pz colori fusto assortiti - 111912,SCARTO_STOCK_SOTTO_SOGLIA,True,True,True,True,4.0,False,True
134983,Espositore da banco 288 matite in grafite Faber-Castell 9000 - gradazioni assortite - 119061,SCARTO_STOCK_SOTTO_SOGLIA,True,True,True,True,2.0,False,True
135008,Portamenu' in PP Lebez a 10 tasche - 33x14 cm - nero - 80560N,SCARTO_STOCK_SOTTO_SOGLIA,True,True,True,True,0.0,False,True
135011,Schermo di protezione da appendere Lebez 66x99 cm 81029,SCARTO_STOCK_SOTTO_SOGLIA,True,True,True,True,3.0,False,True
135012,Schermo di protezione da banco Lebez 55x95 cm 81024,SCARTO_STOCK_SOTTO_SOGLIA,True,True,True,True,3.0,False,True
135026,Libretto scolastico personale O.C.L. 80 pagine - 1203,SCARTO_STOCK_SOTTO_SOGLIA,True,True,True,True,0.0,False,True
135218,Colla vinilica Vinavil speciale scuola conf. da 10 flaconi da 250 g D0652,SCARTO_STOCK_SOTTO_SOGLIA,True,True,True,True,1.0,False,True
135224,Espositore 30 marcatori permanenti Staedtler Lumocolor® 2 mm - nero - 352-9 CA30,SCARTO_STOCK_SOTTO_SOGLIA,True,True,True,True,2.0,False,True
135227,Espositore 30 portamine Mars® Micro con 18 astucci mine - assortiti - 775 CA30P,SCARTO_STOCK_SOTTO_SOGLIA,True,True,True,True,0.0,False,True
135465,Espositore 60 penne a sfera Pilot Frixion Ball New Color 0.7 - 10 colori assortiti - Z99742,SCARTO_STOCK_SOTTO_SOGLIA,True,True,True,True,2.0,False,True
135528,Divisori intercalari Esslete Mylar A4 - conf. 20 ff da 6 tasti colorati cad. - 100168,SCARTO_STOCK_SOTTO_SOGLIA,True,True,True,True,4.0,False,True
135531,Copertina rigida per rilegatura Leitz Channel ''E'' - 186-225 fogli A4 bianco - conf. 10 pz - 74110001,SCARTO_STOCK_SOTTO_SOGLIA,True,True,True,True,1.0,False,True
135533,Batteria ricaricabile Leitz per stampante Icon 70020100,SCARTO_STOCK_SOTTO_SOGLIA,True,True,True,True,3.0,False,True
135534,Copertina rigida per rilegatura Leitz Channel ''E'' - 186-225 fogli A4 nero - conf. 10 pz - 74110095,SCARTO_STOCK_SOTTO_SOGLIA,True,True,True,True,1.0,False,True
135542,Cassettiera 4 cassetti Esselte Colour'Breeze grigio/verde 626285,SCARTO_STOCK_SOTTO_SOGLIA,True,True,True,True,1.0,False,True
135544,"Borsa portacomputer Leitz Complete 13,3'' argento 60180084",SCARTO_STOCK_SOTTO_SOGLIA,True,True,True,True,1.0,False,True
135547,Copertina per rilegatura Leitz flessibile 10 mm conf. da 10 bordeaux 74140028,SCARTO_STOCK_SOTTO_SOGLIA,True,True,True,True,4.0,False,True
135549,Copertina rigida per rilegatura Leitz Channel ''G'' - 266-300 fogli A4 bianco - conf. 10 pz - 74130001,SCARTO_STOCK_SOTTO_SOGLIA,True,True,True,True,3.0,False,True
135550,Copertina per rilegatura Leitz rigida ''E'' conf. da 10 bordeaux 74110028,SCARTO_STOCK_SOTTO_SOGLIA,True,True,True,True,3.0,False,True
135552,Copertina flessibile per rilegatura Leitz Channel ''F'' - 226-265 fogli bianco - conf. 10 pz - 74040001,SCARTO_STOCK_SOTTO_SOGLIA,True,True,True,True,3.0,False,True
135555,Copertina flessibile per rilegatura Leitz Channel ''D'' - 151-185 fogli A4 bordeaux - conf. 10 pz - 74020028,SCARTO_STOCK_SOTTO_SOGLIA,True,True,True,True,4.0,False,True
135597,Cartellina con tasca Euro-Cart serie brillante - 200 g - conf. da 25 - 340x260x4 mm - rosso - XCM07FRO,SCARTO_STOCK_SOTTO_SOGLIA,True,True,True,True,4.0,False,True
135598,Cartella manilla con spillo Euro-Cart 230 g - conf. da 50 pz - 34x25 cm rosa XCM05RS,SCARTO_STOCK_SOTTO_SOGLIA,True,True,True,True,3.0,False,True
135739,Matite colorate Faber-Castell Aqua Goldfaber - conf. 36 pz - colori assortiti - 114639,SCARTO_STOCK_SOTTO_SOGLIA,True,True,True,True,2.0,False,True
135770,Album da disegno Giotto 2 33x48 cm - 12 ff 125 g - conf.10 pz - ruvido F583200,SCARTO_STOCK_SOTTO_SOGLIA,True,True,True,True,3.0,False,True
135836,Distruggidocumenti automatico Leitz Office 150 P4 - taglio a frammenti P-4 4x30 mm - 44 L - 80130000,SCARTO_STOCK_SOTTO_SOGLIA,True,True,True,True,1.0,False,True
135837,Distruggidocumenti automatico Leitz Office 300 P4 - taglio a frammenti P-4 4 x 30 mm - 60 L - 80150000,SCARTO_STOCK_SOTTO_SOGLIA,True,True,True,True,1.0,False,True
135838,Distruggidocumenti automatico Leitz Office 300 P5 - taglio a frammenti P-5 2x15 mm - 60 L - 80160000,SCARTO_STOCK_SOTTO_SOGLIA,True,True,True,True,1.0,False,True
135839,Distruggidocumenti Leitz IQ Home Slim P4 - 80010000,SCARTO_STOCK_SOTTO_SOGLIA,True,True,True,True,1.0,False,True
135871,Album prima nota cassa O.C.L. 50x2 copie - blister da 3 blocchi - 216x305 mm 0131P,SCARTO_STOCK_SOTTO_SOGLIA,True,True,True,True,0.0,False,True
135892,Carta per fotocopie A3 Navigator Office Premium risma da 500 ff 100 g/m² NPR1000205,SCARTO_STOCK_SOTTO_SOGLIA,True,True,False,True,0.0,False,True
135977,Toner Q-Connect rigenerato HP CE278A nero - KF14937,SCARTO_STOCK_SOTTO_SOGLIA,True,True,True,True,3.0,False,True
135978,Toner Q-Connect rigenerato Brother TN-2220 nero - KF15455,SCARTO_STOCK_SOTTO_SOGLIA,True,True,True,True,0.0,False,True
136005,Registratore protocollo Esselte Essentials G75 23x33 cm dorso 8 cm verde chiaro - 390775600,SCARTO_STOCK_SOTTO_SOGLIA,True,True,True,True,0.0,False,True
136198,Dispenser in legno e plastica riciclati Pepernet Simplify white wood per asciugamano piegato C/V - 421337,SCARTO_STOCK_SOTTO_SOGLIA,True,True,True,True,3.0,False,True
136200,Dispenser in legno e plastica riciclati Papernet Simplify white wood per carta igienica interfogliata - 421334,SCARTO_STOCK_SOTTO_SOGLIA,True,True,True,True,1.0,False,True
136264,Etichette giallo fluorescente permanenti Tico laser/inkjet 1 et./foglio conf. 70+10 ff OMAGGIO 210x297 mm,SCARTO_STOCK_SOTTO_SOGLIA,True,True,True,True,3.0,False,True
136273,Pennarelli Giotto TurboPro doppia punta scalpello-pennello - conf. da 15 colori assortiti - F427800,SCARTO_STOCK_SOTTO_SOGLIA,True,True,False,True,0.0,False,True
136274,Pennarelli Giotto TurboPro doppia punta scalpello-pennello - conf. da 30 colori assortiti - F427900,SCARTO_STOCK_SOTTO_SOGLIA,True,True,False,True,3.0,False,True
136312,Espositore da banco 12 pochette Lebez Fluffy Bunny 4 soggetti assortiti - 81881,SCARTO_STOCK_SOTTO_SOGLIA,True,True,False,True,1.0,False,True
136313,Espositore da banco 24 penne con cappuccio Lebez Bunny silicon 4 colori assortiti - 81904,SCARTO_STOCK_SOTTO_SOGLIA,True,True,False,True,1.0,False,True
136398,Copertina flessibile per rilegatura Leitz Channel ''G'' - 266-300 fogli A4 - bordeaux - conf. 10 pz - 74050028,SCARTO_STOCK_SOTTO_SOGLIA,True,True,True,True,2.0,False,True
136399,Copertina flessibile per rilegatura Leitz Channel ''G'' - 266-300 fogli A4 nero - conf. 10 pz - 74050095,SCARTO_STOCK_SOTTO_SOGLIA,True,True,True,True,1.0,False,True
136405,Copertina rigida per rilegatura Leitz Channel ''G'' - 266-300 fogli A4 blu - conf. 10 pz - 74130035,SCARTO_STOCK_SOTTO_SOGLIA,True,True,True,True,1.0,False,True
136406,Copertina rigida per rilegatura Leitz Channel ''F'' - 226-265 fogli A4 nero - conf. 10 pz - 74120095,SCARTO_STOCK_SOTTO_SOGLIA,True,True,True,True,2.0,False,True
136455,"Espositore 96 penne a sfera cancellabili Pilot Frixion Ball Sticks 0,7 mm + 96 set da 30 stickers in OMAGGIO - 010127",SCARTO_STOCK_SOTTO_SOGLIA,True,True,False,True,3.0,False,True
136458,Espositore 120 penne roller con inchiostro a gel Pilot Mix Colors colori assortiti - 010158,SCARTO_STOCK_SOTTO_SOGLIA,True,True,False,True,1.0,False,True
136730,Espositore 36 penne a sfera Lebez Rainbow 4 soggetti assortiti 81895,SCARTO_STOCK_SOTTO_SOGLIA,True,True,False,True,4.0,False,True
136731,Espositore 24 matite Lebez Unicorn 4 soggetti assortiti 81931,SCARTO_STOCK_SOTTO_SOGLIA,True,True,False,True,4.0,False,True
136732,Espositore 8 borsette con tracolla Lebez Donuts 4 soggetti assortiti 81922,SCARTO_STOCK_SOTTO_SOGLIA,True,True,False,True,3.0,False,True
