SKU,title,reason,has_price_row,has_buy,has_listino,has_stock_row,qty,passes_qty,has_image
106949,"Portablocco singolo con molla Sei Rota Superblock ML  21x29,7 cm rosso 29302312",SCARTO_NO_PREZZI_ROW,False,False,False,True,9.0,True,True
114481,Buste a sacco Pigna Envelopes Competitor strip 80 g/m² 162x229 mm bianco Conf. da 20 buste - 0654555,SCARTO_NO_PREZZI_ROW,False,False,False,True,0.0,False,True
128574,"Astuccio 3 evidenziatori Stabilo Boss Mini by Snooze One - colori assortiti verde, blu e giallo - 07/03-61",SCARTO_NO_PREZZI_ROW,False,False,False,True,0.0,False,True
129115,Penna punta in fibra Faber-Castell Ecco Pigment tinta pigmentata - punte assortite - conf. 4 pezzi - 167004,SCARTO_NO_PREZZI_ROW,False,False,False,True,0.0,False,True
137161,Espositore 480 evidenziatori Swing® Cool di cui 220 pezzi singoli e 45 astucci in cartone appendibili - colori assortiti,SCARTO_NO_PREZZI_ROW,False,False,False,True,0.0,False,True
137364,Espositore 96 matite colorate e in grafite Faber-Castell unicorno e dinosauri - 111560,SCARTO_NO_PREZZI_ROW,False,False,False,True,0.0,False,True
137365,Espositore 18 articoli disegno e scrittura Faber-Castell unicorno e dinosauri - 202159,SCARTO_NO_PREZZI_ROW,False,False,False,True,0.0,False,True
137366,Espositore 44 astucci appendibili di matite colorate Faber-Castell Black Edition - 116496,SCARTO_NO_PREZZI_ROW,False,False,False,True,0.0,False,True
137372,Espositore 120 matite in grafite Faber-Castell HB fusto triangolare unicorno e dinosauro - 111555,SCARTO_NO_PREZZI_ROW,False,False,False,True,0.0,False,True
137373,Espositore 144 matite in grafite Faber-Castell HB fusto triangolare unicorno e dinosauro - 111550,SCARTO_NO_PREZZI_ROW,False,False,False,True,0.0,False,True
137374,Espositore 72 matite-evidenziatori Jumbo Grip Neon Faber-Castell colori assortiti 114873,SCARTO_NO_PREZZI_ROW,False,False,False,True,0.0,False,True
100037,Tappetino da taglio Westcott 45x30 cm blu DIN A3 E-46003 00,SCARTO_STOCK_SOTTO_SOGLIA,True,True,True,True,1.0,False,True
100480,Carta colorata Favini Rismaluce colori forti 90 g/m² A3 giallo sole Risma da 300 fogli - A66B313,SCARTO_STOCK_SOTTO_SOGLIA,True,True,True,True,4.0,False,True
100481,Carta colorata Favini Rismaluce colori forti 90 g/m² A3 arancio Risma da 300 fogli - A66E313,SCARTO_STOCK_SOTTO_SOGLIA,True,True,True,True,4.0,False,True
100498,Carta colorata Favini Rismaluce colori forti 140 g/m² A4 scarlatto 61 - Risma da 200 fogli - A65C204,SCARTO_STOCK_SOTTO_SOGLIA,True,True,True,True,2.0,False,True
100505,Carta colorata Favini Rismaluce colori forti 140 g/m² A3 verde - Risma da 200 fogli - A65D213,SCARTO_STOCK_SOTTO_SOGLIA,True,True,True,True,0.0,False,True
100511,Carta colorata Favini Rismacqua colori tenui 140 g/m² A4 verde chiaro 09 Risma da 200 fogli - A65P204,SCARTO_STOCK_SOTTO_SOGLIA,True,True,True,True,0.0,False,True
100515,Carta colorata Favini Rismacqua colori tenui 140 g/m² A3 rosa 10 - Risma da 200 fogli - A65S213,SCARTO_STOCK_SOTTO_SOGLIA,True,True,True,True,2.0,False,True
100599,Carta colorata Favini Rismaluce colori forti 200 g/m² A4 azzurro 55 - Risma da 50 fogli - A69G544,SCARTO_STOCK_SOTTO_SOGLIA,True,True,True,True,0.0,False,True
100613,Cartellina semplice FAVINI FOLDER S cartoncino Simplex Luce&Acqua 200 g/m² 25x34cm mix 5 colori  conf. 50 - A50X664,SCARTO_STOCK_SOTTO_SOGLIA,True,True,True,True,0.0,False,True
100681,Cartoncini Bristol FAVINI 10 BRISTOL superficie levigatissima 200 g/m² 70x100cm azzurro 55  conf.10 - A35G0A1,SCARTO_STOCK_SOTTO_SOGLIA,True,True,True,True,2.0,False,True
100697,Cartoncini Bristol Favini 25 BRISTOL superficie levigatissima 200 g/m² 50x70 cm giallo sole 53 conf.25 - A35B012,SCARTO_STOCK_SOTTO_SOGLIA,True,True,True,True,4.0,False,True
100705,Cartoncini Prisma FAVINI 10 PRISMA monoruvidi colorati 220 g/m² 70x100cm avorio 11  conf.10 - A33Q0A1,SCARTO_STOCK_SOTTO_SOGLIA,True,True,True,True,2.0,False,True
100714,Cartoncini Prisma FAVINI 10 PRISMA monoruvidi colorati 220 g/m² 70x100cm grigio 15  conf.10 - A33W0A1,SCARTO_STOCK_SOTTO_SOGLIA,True,True,True,True,3.0,False,True
100715,Cartoncini Prisma FAVINI 10 PRISMA monoruvidi colorati 220 g/m² 70x100cm verde 37  conf.10 - A33D0A1,SCARTO_STOCK_SOTTO_SOGLIA,True,True,True,True,4.0,False,True
100728,Cartoncini Prisma FAVINI 20 PRISMA monoruvidi colorati 220 g/m² 50x70cm rosa 31  conf.20 - A33S012,SCARTO_STOCK_SOTTO_SOGLIA,True,True,True,True,3.0,False,True
100731,Cartoncini Prisma FAVINI 20 PRISMA monoruvidi colorati 220 g/m² 50x70cm verde 37  conf.20 - A33D012,SCARTO_STOCK_SOTTO_SOGLIA,True,True,True,True,1.0,False,True
100733,Cartoncini Prisma FAVINI 20 PRISMA monoruvidi colorati 220 g/m² 50x70cm turchese 25  conf.20 - A33G012,SCARTO_STOCK_SOTTO_SOGLIA,True,True,True,True,1.0,False,True
100737,Cartoncini Prisma FAVINI 20 PRISMA monoruvidi colorati 220 g/m² 50x70cm arancio 03  conf.20 - A33E012,SCARTO_STOCK_SOTTO_SOGLIA,True,True,True,True,1.0,False,True
100742,Cartoncini Prisma FAVINI 20 PRISMA monoruvidi colorati 220 g/m² 50x70cm indaco 38  conf.20 - A33O012,SCARTO_STOCK_SOTTO_SOGLIA,True,True,True,True,4.0,False,True
100743,Cartoncini Prisma FAVINI 20 PRISMA monoruvidi colorati 220 g/m² 50x70cm caffe' 07  conf.20 - A33L012,SCARTO_STOCK_SOTTO_SOGLIA,True,True,True,True,3.0,False,True
101360,Raccoglitore personalizzabile Sei Rota Stelvio TI A4 - 2 anelli Q 65 mm bianco dorso 9 cm - 35654601,SCARTO_STOCK_SOTTO_SOGLIA,True,True,True,True,0.0,False,True
101389,Cartella portaprogetti con bottone Sei Rota Big - dorso 12 cm blu - 26x36 cm 68001207,SCARTO_STOCK_SOTTO_SOGLIA,True,True,True,True,0.0,False,True
101414,Cartella portaprogetti Sei Rota Spazio - dorso 8 cm verde - 26x36 cm 67890805,SCARTO_STOCK_SOTTO_SOGLIA,True,True,True,True,4.0,False,True
101422,Cartella portaprogetti Sei Rota Spazio - dorso 12 cm verde - 26x36 cm 67891205,SCARTO_STOCK_SOTTO_SOGLIA,True,True,True,True,0.0,False,True
101973,"Etichette bianche con margini TICO Copy Laser Premium 38x21,2 mm - 65 et./foglio - conf. 100 fogli - LP4W-3821",SCARTO_STOCK_SOTTO_SOGLIA,True,True,True,True,1.0,False,True
101982,Etichette bianche senza margini TICO Copy Laser Premium 70x25 mm - 36 et./foglio - conf. 100 fogli - LP4W-7025,SCARTO_STOCK_SOTTO_SOGLIA,True,True,True,True,1.0,False,True
101991,"Etichette bianche con angoli arrotondati TICO Copy Laser Premium 99,1x93,1 mm 6 et./foglio - conf. 100 fogli - LP4W-9993",SCARTO_STOCK_SOTTO_SOGLIA,True,True,True,True,0.0,False,True
101996,Etichette bianche con margini TICO Copy Laser Premium 105x57 mm - 10 et./foglio - conf. 100 fogli LP4W-10557,SCARTO_STOCK_SOTTO_SOGLIA,True,True,True,True,0.0,False,True
102010,"Etichette arancione fluo con angoli arrotondati TICO Copy Laser 47,5x25,5 mm 44 et/foglio - conf. 70 fogli LP4FA-4725",SCARTO_STOCK_SOTTO_SOGLIA,True,True,True,True,0.0,False,True
102019,"Etichette verde fluo con angoli arrotondati TICO Copy Laser  99,1x34 mm 16 et/foglio - conf. 70 fogli LP4FV-9934",SCARTO_STOCK_SOTTO_SOGLIA,True,True,True,True,4.0,False,True
102021,"Etichette arancio fluo con angoli arrotondati TICO Copy Laser 99,1x67,7 mm 8 et./foglio - conf. 70 fogli LP4FA-9967",SCARTO_STOCK_SOTTO_SOGLIA,True,True,True,True,0.0,False,True
102025,Etichette arancione fluo con angoli arrotondati TICO Copy Laser 200x142 mm 2 et./foglio conf. 70 fogli LP4FA-200142,SCARTO_STOCK_SOTTO_SOGLIA,True,True,True,True,0.0,False,True
102241,Hard Disk Esterno Verbatim Store'n ' Save 3.0 2 TB nero - 47683,SCARTO_STOCK_SOTTO_SOGLIA,True,True,True,True,4.0,False,True
102244,Hard Disk Esterno Verbatim Store 'n' Go USB 3.0 1 TB nero - 53194,SCARTO_STOCK_SOTTO_SOGLIA,True,True,True,True,3.0,False,True
102245,Hard Disk Esterno Verbatim Store 'n' Go USB 3.0 2 TB nero - 53195,SCARTO_STOCK_SOTTO_SOGLIA,True,True,True,True,2.0,False,True
102246,Hard Disk Esterno Verbatim Store 'n' Go USB 3.0 4 TB nero - 53223,SCARTO_STOCK_SOTTO_SOGLIA,True,True,True,True,3.0,False,True
102247,Hard Disk Esterno Verbatim Store 'n' Go USB 3.0 1 TB argento - 53197,SCARTO_STOCK_SOTTO_SOGLIA,True,True,True,True,3.0,False,True
102248,Hard Disk Esterno Verbatim Store 'n' Go USB 3.0 2 TB argento - 53198,SCARTO_STOCK_SOTTO_SOGLIA,True,True,True,True,2.0,False,True
102252,Hard Disk Esterno Verbatim Store'n' Go Secure 3.1 con tastierino d'accesso 1 TB nero - 53401,SCARTO_STOCK_SOTTO_SOGLIA,True,True,True,True,0.0,False,True
102257,Flash Memory Card SDHC Verbatim 16 GB  43962,SCARTO_STOCK_SOTTO_SOGLIA,True,True,True,True,4.0,False,True
102270,DVD-R Wide Stampabile Verbatim 4.7 GB Spindle Case in confezione da 25 dvd - 43538,SCARTO_STOCK_SOTTO_SOGLIA,True,True,True,True,4.0,False,True
102274,Blu-Ray BD-RE Verbatim 25 GB 2x Jewel Case conf. da 5 - 43615,SCARTO_STOCK_SOTTO_SOGLIA,True,True,True,True,3.0,False,True
102280,DVD+R Double Layer Verbatim Jewel case 8.5 GB - velocità 8x conf. da 5 - 43541,SCARTO_STOCK_SOTTO_SOGLIA,True,True,True,True,3.0,False,True
102325,Chiavetta USB 2.0 Store 'n' Stay Nano Verbatim 32 GB 98130,SCARTO_STOCK_SOTTO_SOGLIA,True,True,True,True,2.0,False,True
102327,Chiavetta  USB 3.0 Metal Executive Verbatim 32 GB 99105,SCARTO_STOCK_SOTTO_SOGLIA,True,True,True,True,0.0,False,True
102336,Raccoglitore Euro-cart Iris A4 dorso 4 cm - 4 anelli tondi 30 mm blu CPCL4-30BLU,SCARTO_STOCK_SOTTO_SOGLIA,True,True,True,True,0.0,False,True
102515,Etichette bianco lucido TICO Press Glossy 36x22 mm - 55 et./foglio - conf. 100 fogli - PG4-3622,SCARTO_STOCK_SOTTO_SOGLIA,True,True,True,True,3.0,False,True
102516,Etichette ovali TICO Press Glossy 36x27 mm bianco lucido - 50 et./foglio - conf. 100 fogli - PG4-3627,SCARTO_STOCK_SOTTO_SOGLIA,True,True,True,True,3.0,False,True
102517,Etichette bianco lucido TICO Press Glossy 45x25 mm - 40 et./foglio - conf. 100 fogli - PG4-4525,SCARTO_STOCK_SOTTO_SOGLIA,True,True,True,True,2.0,False,True
102519,Etichette bianco lucido TICO Press Glossy 61x28 mm - 27 et./foglio - conf. 100 fogli - PG4-6128,SCARTO_STOCK_SOTTO_SOGLIA,True,True,True,True,2.0,False,True
102520,Etichette bianco lucido TICO Press Glossy 61x36 mm - 21 et./foglio - conf. 100 fogli - PG4-6136,SCARTO_STOCK_SOTTO_SOGLIA,True,True,True,True,2.0,False,True
102534,Plastificatrice a caldo Q-Connect a 2 rulli nero A3 KF17003,SCARTO_STOCK_SOTTO_SOGLIA,True,True,True,True,3.0,False,True
102551,"Etichette universali Q-Connect bianco 70x42,3 mm - 21 et./foglio - conf. da 100 fogli - KF10649",SCARTO_STOCK_SOTTO_SOGLIA,True,True,True,True,1.0,False,True
102561,Etichette universali Q-Connect per CD/DVD Ø 116 mm bianco 2. et/foglio Conf. 25 fogli - KF01579,SCARTO_STOCK_SOTTO_SOGLIA,True,True,True,True,3.0,False,True
102733,Foglietti riposizionabili Q-Connect 70 g/m² arancio neon 76x76 mm 6 blocchetti da 80 ff - KF10517,SCARTO_STOCK_SOTTO_SOGLIA,True,True,True,True,3.0,False,True
102740,Foglietti riposizionabili Q-Connect 100% materiale riciclato 65 g/m² giallo 76x127mm  12 blocc. da 100 ff - KF05610,SCARTO_STOCK_SOTTO_SOGLIA,True,True,True,True,4.0,False,True
102853,"Cartellina con clip Q-Connect PVC 22x30,7 cm blu KF00462",SCARTO_STOCK_SOTTO_SOGLIA,True,True,True,True,0.0,False,True
102929,Marcatore a tempera POSCA Uni-Ball punta a scalpello 8 mm giallo M PC8K G,SCARTO_STOCK_SOTTO_SOGLIA,True,True,True,True,0.0,False,True
102964,"Penna a sfera a scatto Q-Connect punta M 0,7 mm rosso - conf. da 10 pezzi - KF00269",SCARTO_STOCK_SOTTO_SOGLIA,True,True,True,True,0.0,False,True
102996,"Evidenziatore Q-Connect 1,5-5 mm blu  KF01114",SCARTO_STOCK_SOTTO_SOGLIA,True,True,True,True,0.0,False,True
103027,Matite colorate Faber-Castell Colour Grip assortiti astuccio da 12 - 112469,SCARTO_STOCK_SOTTO_SOGLIA,True,True,True,True,2.0,False,True
103030,Matite colorate Faber-Castell Colour Grip assortiti astuccio di metallo da 36 - 112435,SCARTO_STOCK_SOTTO_SOGLIA,True,True,True,True,2.0,False,True
103063,Pastelli a olio Faber-Castell Oil Pastels Creative Studio assortiti astuccio di cartone da 36 - 127036,SCARTO_STOCK_SOTTO_SOGLIA,True,True,True,True,2.0,False,True
103096,Temperamatite Faber-Castell Sleeve 2 fori con serbatoio nero 182700,SCARTO_STOCK_SOTTO_SOGLIA,True,True,True,True,0.0,False,True
103175,"Evidenziatore Pastel Q-Connect 1,5-5 mm verde KF17959",SCARTO_STOCK_SOTTO_SOGLIA,True,True,True,True,0.0,False,True
103494,Portadocumenti con bottone Q-Connect A4 ppl verde KF03597,SCARTO_STOCK_SOTTO_SOGLIA,True,True,True,True,0.0,False,True
103900,Libro firme Q-Connect 20 pagine 24x35 cm nero KF31014,SCARTO_STOCK_SOTTO_SOGLIA,True,True,True,True,0.0,False,True
104397,Pannello per leggìo da tavolo Q-Connect Quickfind rosso conf. 10 pezzi - KF04258,SCARTO_STOCK_SOTTO_SOGLIA,True,True,True,True,4.0,False,True
104626,Registro 194 fogli Pigna Monocromo A4 quadretti 5 mm assortiti 02068735M,SCARTO_STOCK_SOTTO_SOGLIA,True,True,True,True,0.0,False,True
105010,Distruggidocumenti uso moderato FELLOWES Powershred® 125Ci P-4 - 53 L - taglio a frammenti 4x38 mm - 4612002,SCARTO_STOCK_SOTTO_SOGLIA,True,True,True,True,1.0,False,True
105013,Distruggidocumenti uso frequente FELLOWES Powershred 225Ci P-4 60 L taglio a frammento 4x38 mm - 4622003,SCARTO_STOCK_SOTTO_SOGLIA,True,True,True,True,1.0,False,True
105014,Distruggidocumenti uso frequente FELLOWES Powershred 225Mi P-5 60L taglio a microframmento 2x12 mm - 4620101,SCARTO_STOCK_SOTTO_SOGLIA,True,True,True,True,0.0,False,True
105017,Distruggidocumenti uso frequente FELLOWES Powershred 425Ci P-4 - 114 L taglio a frammenti 4x30 mm - 4698001,SCARTO_STOCK_SOTTO_SOGLIA,True,True,True,True,0.0,False,True
105019,Distruggidocumenti uso personale FELLOWES Powershred® 53C - P-4 - 23 L taglio a frammenti 4x35 mm - 4653101,SCARTO_STOCK_SOTTO_SOGLIA,True,True,True,True,4.0,False,True
105025,Distruggidocumenti uso moderato FELLOWES Powershred® 79Ci - P-4 - 23 L - taglio a frammenti 4x38 mm - 4679004,SCARTO_STOCK_SOTTO_SOGLIA,True,True,True,True,1.0,False,True
105031,Distruggidocumenti uso moderato FELLOWES AutoMax? 200C - P-4 - 32 L - taglio a frammenti 4x38 mm - nero - 4653602,SCARTO_STOCK_SOTTO_SOGLIA,True,True,True,True,3.0,False,True
105032,Distruggidocumenti uso moderato FELLOWES AutoMax? 200M - P-5 - 32 L - taglio a microframmenti 2x14 mm nero - 4656301,SCARTO_STOCK_SOTTO_SOGLIA,True,True,True,True,2.0,False,True
105033,Distruggidocumenti uso frequente  P-4 68 L FELLOWES AutoMax? 350C - taglio a frammenti 4x38 mm nero - 4964101,SCARTO_STOCK_SOTTO_SOGLIA,True,True,True,True,0.0,False,True
105066,Plastificatrice a caldo FELLOWES Neptune 3 argento/nero A3 5721501,SCARTO_STOCK_SOTTO_SOGLIA,True,True,True,True,0.0,False,True
105080,Rilegatrice a dorsi metallici FELLOWES Galaxy Wire Capacità di perforazione 20 fogli - 5622401,SCARTO_STOCK_SOTTO_SOGLIA,True,True,True,True,0.0,False,True
105081,Rilegatrice a dorsi plastici FELLOWES Pulsar+ 300 capacità di perforazione 17 fogli - 5627601,SCARTO_STOCK_SOTTO_SOGLIA,True,True,True,True,4.0,False,True
105082,Rilegatrice a dorsi plastici FELLOWES Quasar+ 500 capacità di perforazione 25 fogli - 5627701,SCARTO_STOCK_SOTTO_SOGLIA,True,True,True,True,1.0,False,True
105083,Rilegatrice a dorsi metallici FELLOWES Quasar Wire Capacità di perforazione 15 fogli - 5224101,SCARTO_STOCK_SOTTO_SOGLIA,True,True,True,True,1.0,False,True
105084,Rilegatrice a dorsi plastici FELLOWES Star+ 150 capacità di perforazione 15 fogli - 5627501,SCARTO_STOCK_SOTTO_SOGLIA,True,True,True,True,2.0,False,True
105085,Rilegatrice a dorsi plastici FELLOWES Starlet 2+ 120 capacità di perforazione 12 fogli - 5227901,SCARTO_STOCK_SOTTO_SOGLIA,True,True,True,True,2.0,False,True
105086,Rilegatrice termica FELLOWES Helios 30 capacità di rilegatura 240 fogli 5641001,SCARTO_STOCK_SOTTO_SOGLIA,True,True,True,True,1.0,False,True
105087,Rilegatrice termica FELLOWES Helios 60 capacità di rilegatura 600 fogli 5642003,SCARTO_STOCK_SOTTO_SOGLIA,True,True,True,True,4.0,False,True
105089,Sacchetti per distruggidocumenti FELLOWES capacità tra 23 e 28 l 100pz - 36052,SCARTO_STOCK_SOTTO_SOGLIA,True,True,True,True,2.0,False,True
105090,Sacchetti per distruggidocumenti Fellowes capacità fino a 34 lt. Conf. 100 pezzi - 36053,SCARTO_STOCK_SOTTO_SOGLIA,True,True,True,True,2.0,False,True
105117,"Supporto FELLOWES Premium per CPU acciaio nero 24,1x20,3x22,9 cm 9169201",SCARTO_STOCK_SOTTO_SOGLIA,True,True,True,True,3.0,False,True
105121,"Supporto FELLOWES Premium Plus per monitor plastica riciclata grigio 34,3x33,3x6,4-16,5 cm - 91713",SCARTO_STOCK_SOTTO_SOGLIA,True,True,True,True,2.0,False,True
105123,"Supporto FELLOWES Smart Suites per monitor plus ABS grigio/nero 47,8x32,8cm con vaschetta portaoggetti - 8020801",SCARTO_STOCK_SOTTO_SOGLIA,True,True,True,True,0.0,False,True
105124,Supporto FELLOWES Premium per monitor plastica riciclata grafite 18x33x34 cm 9169401,SCARTO_STOCK_SOTTO_SOGLIA,True,True,True,True,3.0,False,True
105125,Supporto FELLOWES Smart Suites per monitor plastica grigio/nero 30x53 cm 8020101,SCARTO_STOCK_SOTTO_SOGLIA,True,True,True,True,3.0,False,True
105129,Supporto FELLOWES Office Suites? per schiena tessuto in rete nero 50x45x16 cm 9191301,SCARTO_STOCK_SOTTO_SOGLIA,True,True,True,True,4.0,False,True
105130,Supporto FELLOWES Professional Series? per schiena tessuto in rete nero 50x45x16cm - 8029901,SCARTO_STOCK_SOTTO_SOGLIA,True,True,True,True,3.0,False,True
105131,"Supporto FELLOWES Deluxe Office Suites per tastiera plastica nero 7,2x61x36,5 cm - 8031201",SCARTO_STOCK_SOTTO_SOGLIA,True,True,True,True,2.0,False,True
105159,"Penna a sfera ricaricabile Pilot BPS punta fine 0,7 mm nero 001606",SCARTO_STOCK_SOTTO_SOGLIA,True,True,True,True,0.0,False,True
105186,"Roller a inchiostro liquido Pilot V BALL punta fine 0,5 mm nero F 011260",SCARTO_STOCK_SOTTO_SOGLIA,True,True,True,True,4.0,False,True
105207,"Marcatore punta a scalpello Pilot SCA maxi 6600 3-12,5 mm rosso 002433",SCARTO_STOCK_SOTTO_SOGLIA,True,True,True,True,0.0,False,True
105266,"Roller Pilot Hi Tecpoint V7 0,7 mm nero  011710",SCARTO_STOCK_SOTTO_SOGLIA,True,True,True,True,0.0,False,True
105350,Penne a punta sintetica Staedtler Lumocolor permanent pen 313 s assortiti astuccio da 4 pezzi - 313 WP4,SCARTO_STOCK_SOTTO_SOGLIA,True,True,True,True,2.0,False,True
105354,Penne a punta sintetica Staedtler Lumocolor permanent pen 317 M assortiti astuccio da 4 pezzi - 317 WP4,SCARTO_STOCK_SOTTO_SOGLIA,True,True,True,True,4.0,False,True
105420,Quaderno 42 fogli PIGNA Monocromo A4 a quadretti 10 mm assortiti 022988710,SCARTO_STOCK_SOTTO_SOGLIA,True,True,True,True,0.0,False,True
105610,"Fineliner Stabilo Point 88 0,4 mm assortiti scatola in metallo da 50 - 8850-6",SCARTO_STOCK_SOTTO_SOGLIA,True,True,True,True,2.0,False,True
105693,Evidenziatori Stabilo Luminator 2-5 mm assortiti set da scrivania da 4 - 7104-2,SCARTO_STOCK_SOTTO_SOGLIA,True,True,True,True,3.0,False,True
105974,Dispenser per nastro adesivo Scotch® Magic? C38 nero + 12 rotoli 19 mm x 33 m SM12 Black,SCARTO_STOCK_SOTTO_SOGLIA,True,True,True,True,1.0,False,True
106196,Pennarelli per tessuti GIOTTO Decor Textile tratto fine 1-3 mm assortiti astuccio da 8 + t-shirt bianca - 494500,SCARTO_STOCK_SOTTO_SOGLIA,True,True,True,True,1.0,False,True
106282,Matite acquarellabili GIOTTO Stilnovo Acquarell assortiti scatola in metallo da 36 - F256400,SCARTO_STOCK_SOTTO_SOGLIA,True,True,True,True,1.0,False,True
106417,Penna a punta sintetica TRATTO Pen 2 mm assortiti astuccio appendibile da 12 - F807700,SCARTO_STOCK_SOTTO_SOGLIA,True,True,True,True,0.0,False,True
106555,Portastampati da banco Q-Connect 1/3 di A4 in polistirolo trasparente 4 scomparti - KF04186,SCARTO_STOCK_SOTTO_SOGLIA,True,True,True,True,0.0,False,True
107001,"Custodia per raccoglitori e registratori Sei Rota 30 A4 f.to esterno 26,5x32 cm - dorso 4,5 cm nero - 67143010",SCARTO_STOCK_SOTTO_SOGLIA,True,True,True,True,0.0,False,True
107002,"Custodia per raccoglitori e registratori Sei Rota 40 A4 f.to esterno 28,5x32 cm - dorso 6,5 cm nero - 67144010",SCARTO_STOCK_SOTTO_SOGLIA,True,True,True,True,0.0,False,True
107003,"Custodia per raccoglitori e registratori Sei Rota 50 A4 f.to esterno 29,5x32 cm - dorso 8 cm nero - 67145010",SCARTO_STOCK_SOTTO_SOGLIA,True,True,True,True,0.0,False,True
107005,Custodia per raccoglitori e registratori Sei Rota 65 A4 f.to esterno 28x32 cm - dorso 10 cm nero - 67146510,SCARTO_STOCK_SOTTO_SOGLIA,True,True,True,True,1.0,False,True
107010,Buste a fortatura universale Sei Rota Atla F per fotografie 4 spazi 15x21 cm trasparente  Conf. 10 pezzi - 662503,SCARTO_STOCK_SOTTO_SOGLIA,True,True,True,True,0.0,False,True
107039,Portalistini Sei Rota Asso - 20 buste 22x30 cm blu 57212007,SCARTO_STOCK_SOTTO_SOGLIA,True,True,True,True,2.0,False,True
107049,Portalistini Sei Rota Asso - 40 buste 22x30 cm rosso 57214012,SCARTO_STOCK_SOTTO_SOGLIA,True,True,True,True,3.0,False,True
107246,Segnaletica da pavimento forma ''croce'' DURABLE RAL 1003 giallo 15x15 cm Conf. 10 pezzi - 170104,SCARTO_STOCK_SOTTO_SOGLIA,True,True,True,True,2.0,False,True
107247,Buste a fascia DURABLE per piede pallet plastica blu scuro 145 x 65 mm conf. 50 - 172407,SCARTO_STOCK_SOTTO_SOGLIA,True,True,True,True,4.0,False,True
107248,Bobina di nastro antiscivolo adesivo DURABLE DURALINE STRONG rosso 172503,SCARTO_STOCK_SOTTO_SOGLIA,True,True,True,True,3.0,False,True
107249,Bobina di nastro antiscivolo adesivo DURABLE DURALINE STRONG giallo 172504,SCARTO_STOCK_SOTTO_SOGLIA,True,True,True,True,3.0,False,True
107252,Bobina di nastro antiscivolo adesivo DURABLE DURALINE 50/07 rosso segnale-bianco - 1726132,SCARTO_STOCK_SOTTO_SOGLIA,True,True,True,True,1.0,False,True
107254,Pittogramma di sicurezza ''Vietato fumare'' DURABLE rosso Ø 430 mm 172803,SCARTO_STOCK_SOTTO_SOGLIA,True,True,True,True,1.0,False,True
107255,Pittogramma da pavimento ''Indossare la protezione auricolare'' DURABLE azzurro Ø 430 mm - 172906,SCARTO_STOCK_SOTTO_SOGLIA,True,True,True,True,2.0,False,True
107256,Pittogramma da pavimento ''Accesso vietato alle persone non autorizzate'' DURABLE rosso Ø 430 mm - 173003,SCARTO_STOCK_SOTTO_SOGLIA,True,True,True,True,2.0,False,True
107260,Pittogramma da pavimento ''Gilet di sicurezza alta visibilità obbligatorio'' Durable azzurro Ø 430 mm - 173506,SCARTO_STOCK_SOTTO_SOGLIA,True,True,True,True,3.0,False,True
107261,Tasche per identificazione Durable con bande magnetiche blu f.to esterno mm. 130x53- inserto 100x38mm cf. 50 - 174107,SCARTO_STOCK_SOTTO_SOGLIA,True,True,True,True,4.0,False,True
107264,Tasche per identificazione Durable con bande magnetiche blu f.to esterno mm. 223x313- inserto A4 vert. cf. 50- 174407,SCARTO_STOCK_SOTTO_SOGLIA,True,True,True,True,3.0,False,True
107265,Tasche per identificazione Durable con bande magnetiche blu f.to esterno mm. 311x225- inserto A4 orizz. cf 50- 174507,SCARTO_STOCK_SOTTO_SOGLIA,True,True,True,True,1.0,False,True
107268,Tasche per identificazione Durable con fascette di aggancio blu f.to esterno mm 223x380- inserto A5 orizz. Cf 50- 174907,SCARTO_STOCK_SOTTO_SOGLIA,True,True,True,True,0.0,False,True
107270,Tasche per identificazione Durable con fascette di aggancio blu f.to esterno mm 311x442- inserto A4 orizz. cf 50- 175107,SCARTO_STOCK_SOTTO_SOGLIA,True,True,True,True,4.0,False,True
107273,"Tasche per identificazione Durable con bande adesive blu f.to esterno mm. 163x 83x1,7- inserto 150x67mm cf. 50 - 176207",SCARTO_STOCK_SOTTO_SOGLIA,True,True,True,True,2.0,False,True
107276,"Tasche per identificazione Durable con bande adesive blu f.to esterno mm. 223x 163x1,7- inserto A5 orizz. cf 50- 179507",SCARTO_STOCK_SOTTO_SOGLIA,True,True,True,True,1.0,False,True
107277,"Tasche per identificazione Durable con bande adesive blu f.to esterno mm. 233x 313x1,7- inserto A4 vert. cf. 50- 179707",SCARTO_STOCK_SOTTO_SOGLIA,True,True,True,True,2.0,False,True
107278,Cassetta portachiavi DURABLE KEY BOX 18 alluminio argento metallizzato - serratura a chiave - 195123,SCARTO_STOCK_SOTTO_SOGLIA,True,True,True,True,3.0,False,True
107279,Cassetta portachiavi DURABLE KEY BOX 36 alluminio argento metallizzato - serratura a chiave - 195223,SCARTO_STOCK_SOTTO_SOGLIA,True,True,True,True,3.0,False,True
107280,Cassetta portachiavi DURABLE KEY BOX 72 alluminio argento metallizzato - serratura a chiave - 195523,SCARTO_STOCK_SOTTO_SOGLIA,True,True,True,True,3.0,False,True
107282,Cassetta portachiavi DURABLE KEY BOX PLUS 54 posti alluminio argento met. serratura a combinazione - 196823,SCARTO_STOCK_SOTTO_SOGLIA,True,True,True,True,2.0,False,True
107288,Porta carte di credito DURABLE RFID Secure 54x86 mm antracite per 8 carte 230958,SCARTO_STOCK_SOTTO_SOGLIA,True,True,True,True,0.0,False,True
107302,Cestino gettacarte DURABLE cilindrico con superficie perforata acciaio 15 l nero - 330001,SCARTO_STOCK_SOTTO_SOGLIA,True,True,True,True,4.0,False,True
107309,Posacenere Durable a colonna acciaio con sabbia e cestino base tonda H 62 x Ø 26 cm nero - 333001,SCARTO_STOCK_SOTTO_SOGLIA,True,True,True,True,3.0,False,True
107310,Posacenere Durable a colonna acciaio con sabbia e cestino base tonda H 62 x Ø 26 cm argento metallizzato - 333023,SCARTO_STOCK_SOTTO_SOGLIA,True,True,True,True,2.0,False,True
107311,Posacenere Durable a colonna acciaio con sabbia e cestino base quadrata H 62 x Ø 25 cm nero - 333101,SCARTO_STOCK_SOTTO_SOGLIA,True,True,True,True,2.0,False,True
107312,Posacenere Durable a colonna acciaio con sabbia e cestino base quadrata H 62 x Ø 25 cm argento metallizzato - 333123,SCARTO_STOCK_SOTTO_SOGLIA,True,True,True,True,1.0,False,True
107313,Posacenere DURABLE autoestinguente a colonna con sabbia e cestino acciaio nero base tonda - 333201,SCARTO_STOCK_SOTTO_SOGLIA,True,True,True,True,3.0,False,True
107314,Posacenere DURABLE autoestinguente a colonna - cestino acciaio argento metallizzato base tonda - 333223,SCARTO_STOCK_SOTTO_SOGLIA,True,True,True,True,3.0,False,True
107316,"Portaombrelli DURABLE acciaio verniciato nero capacità 28,5 lt - Ø 26 cm - h 62 cm - 335001",SCARTO_STOCK_SOTTO_SOGLIA,True,True,True,True,0.0,False,True
107317,"Portaombrelli DURABLE acciaio verniciato argento metallizzato capacità 28,5 lt - Ø 26 cm - h 62 cm - 335023",SCARTO_STOCK_SOTTO_SOGLIA,True,True,True,True,0.0,False,True
